Subject,Trend Score,Summary,Link,Relevancy,Why It Matters,Companies,Publish Date
General Dynamics Electric Boat wins $2.28B Columbia-class SSBN advance procurement contract modification,90,"General Dynamics Electric Boat received a $2.28 billion cost-only contract modification from the U.S. Navy for advance procurement and early construction work on Columbia-class ballistic missile submarine hulls SSBN 828–832, funded primarily through the FY26 National Sea-Based Deterrence Fund with work running through 2031.",https://www.govconwire.com/articles/general-dynamics-navy-contract,Institutional investors & public-markets analysts,"Extends the Columbia-class production ramp, locking in long-dated cash flows for General Dynamics and signaling continued U.S. commitment to sea-based nuclear deterrence—important for defense portfolios and suppliers tied into the nuclear submarine supply chain.",General Dynamics Electric Boat; U.S. Navy,2025-11-18
Keen Venture Partners closes €150M dedicated DefenceTech fund backed by EIF,88,"London-based Keen Venture Partners raised a €150 million DefenceTech fund—described as Europe’s largest dedicated vehicle in the segment—with cornerstone capital from the European Investment Fund and other institutional LPs, targeting dual-use autonomy, cyber, SATCOM and advanced materials startups across Europe.",https://sesamers.com/fundraising/keen-venture-partners-defencetech-fund-150m-raising/,VC investors and defence-tech founders,"Launch of a sector-specific fund at this scale is a major signal for European defence-tech deal flow, increasing available growth capital for dual-use startups and validating defence as an investable VC category rather than a niche thesis.",Keen Venture Partners; European Investment Fund,2025-11-18
RTX’s Raytheon secures $699M U.S. Army NASAMS air-defense procurement contract,86,"RTX subsidiary Raytheon won a $698.9 million firm-fixed-price contract from the U.S. Army to supply NASAMS fire units, with work to be performed in Tewksbury, MA through February 2031 and funded via foreign military sales accounts.",https://www.govconwire.com/articles/raytheon-army-nasams-contract,VCs & founders focused on air and missile defense,"Highlights sustained demand for layered air-defense against cruise missiles and UAVs, reinforcing NASAMS as a de facto standard and creating follow-on opportunities across sensors, effectors and counter-UAS ecosystems.",RTX; Raytheon; U.S. Army,2025-11-18
Ondas Holdings Closes $225M Sentrycs Acquisition and Secures $8.2M European Airport C-UAS Contract,86,Ondas Holdings (NASDAQ: ONDS) completed acquisition of Israel-based Sentry CS Ltd (Sentrycs) for $225M in cash and stock on November 17 simultaneously announcing $8.2M contract to deploy Iron Drone Raider autonomous counter-UAS system at major European airport. Sentrycs brings Cyber-over-RF (CoRF) technology deployed in 25+ countries enabling soft-kill drone interception via communication protocol takeover. Combined with Iron Drone's kinetic interception Ondas now offers dual-layer C-UAS solution. Q3 2025 revenue reached $10.1M (6x YoY). Stock surged approximately 900% in recent months with analysts raising 12-month price target to $11.07. Safe Pro Group received $20M+ strategic funding including $14M from Ondas at $7/share. Sentrycs sellers face 10% daily trading volume limits to prevent overhang.,https://ts2.tech/en/ondas-holdings-onds-lands-8-2m-airport-drone-defense-deal-and-closes-225m-sentrycs-acquisition-on-november-17-2025/,VC Investors: VERY HIGH - Validates counter-drone M&A strategy and 900% return demonstrates market momentum. Founders: HIGH - Shows acquisition pathway for defense tech scale and dual-layer solution positioning. Institutional: VERY HIGH - Major acquisition with immediate revenue accretion and blue-chip airport reference customer. Researchers: MEDIUM - C-UAS technology integration case study. General: MEDIUM - Civilian airport security relevance.,Transforms Ondas into full-spectrum counter-UAS vendor combining cyber soft-kill (Sentrycs) and kinetic interception (Iron Drone) under one platform. $8.2M European airport contract provides marquee civilian reference customer in highly sensitive environment strengthening credibility for critical infrastructure bids. Acquisition timing amid Ukraine/Russia drone warfare escalation validates standalone C-UAS as multi-billion dollar market. Explosive 900% stock gain and 6x revenue growth signals strong market validation of counter-drone solutions. Cyber-over-RF technology operates at protocol layer without GPS jamming which is critical for crowded airspace.,Ondas Holdings; Sentrycs (acquired); Safe Pro Group; Oppenheimer,"Nov 17, 2025"
Bone AI Raises $12M Seed Round to Build Next-Gen Defense Robotics Challenging Asian Defense Giants,83,Seoul and Palo Alto-based Bone AI secured $12M seed round led by Third Prime with participation from Kolon Group targeting development of AI-driven autonomous vehicles across air land and sea domains for defense clients. Despite being less than 1 year old company acquired Korean drone manufacturer D-Makers and its IP six months post-launch generated $3M revenue in first year and landed seven-figure government contract. Founder DK Lee (previously co-founded MarqVision) personally committed $1.5M+ (approximately 10%+ of round). Company integrates AI software division with acquired hardware manufacturing capability with additional acquisitions planned. Focuses on B2G contracts initially with aerial drones for logistics wildfire detection and counter-drone defense. Strategic investor Kolon Group brings expertise in advanced materials and manufacturing. Represents rare Asian defense tech startup achieving rapid traction in market dominated by incumbents.,https://techcrunch.com/2025/11/17/bone-ai-raises-funding-to-challenge-asias-defense-giants-with-next-gen-ai-powered-robotics/,VC Investors: VERY HIGH - Demonstrates viable defense tech startup model in underserved Asian market with rapid revenue generation. Founders: VERY HIGH - Case study in acceleration via M&A from founding to revenue/contracts in months through IP acquisition. Institutional: MEDIUM-HIGH - Early-stage but strong traction signals validates South Korean defense innovation. Researchers: HIGH - Physical AI and robotics integration in defense context. General: MEDIUM - Geopolitical implications of Asian defense tech emergence.,Validates emerging defense tech startup ecosystem in South Korea previously absent compared to U.S. (Anduril $30B+) Europe (Helsing $13B) and Israel. Speed-to-market strategy combining AI software with acquired hardware IP demonstrates alternative to traditional defense contractor model. Founder's 10%+ personal investment ($1.5M) signals strong conviction and aligns incentives. South Korea's hardware manufacturing legacy (Hyundai Samsung LG) provides foundation for scaling physical AI products. $3M first-year revenue and government contract within months represents unprecedented velocity for defense tech. Strategic positioning as regional alternative amid U.S.-China tension and allied defense spending increases. Third Prime's investment thesis around sovereign AI multipolarity and reindustrialization reflects broader geopolitical defense realignment.,Bone AI; Third Prime; Kolon Group; D-Makers (acquired),2025-11-17
Boeing captures $876M U.S. Army CH-47F Block II Chinook support contract,82,"The U.S. Army awarded Boeing an $876.4 million contract for logistics, training and engineering support tied to 60 CH-47F Block II Chinook helicopters, with work in Ridley Park, PA extending through 2035 as the service fields upgraded heavy-lift platforms to combat brigades.",https://www.govconwire.com/articles/army-contract-award-boeing-ch47f-block-ii,Public-equity investors and rotorcraft supply-chain founders,"Locks in long-tail sustainment revenue on top of prior production lots, underlining the Army’s commitment to Block II Chinook as its heavy-lift backbone and providing visibility for rotorcraft, drivetrain and mission-equipment suppliers.",Boeing; U.S. Army,"Nov 17, 2025"
ASRC Federal wins potential $1.18B DLA ChemPOL contract for multi-service sustainment,80,"ASRC Federal secured a sole-source Defense Logistics Agency long-term contract worth up to $1.18 billion to supply third-generation chemicals, petroleum, oils and lubricants (ChemPOL) to all U.S. services and select civilian agencies over a base five-year term plus up to five additional option years.",https://www.govconwire.com/articles/asrc-federal-dla-contract-chempol-supply,Institutional investors & industrial base strategists,"Signals consolidation of critical consumables logistics under a single integrator, with implications for sustainment resilience, margins in defense logistics, and integration synergies from ASRC’s earlier acquisition of SAIC’s supply-chain business.",ASRC Federal; Defense Logistics Agency; U.S. Army; U.S. Navy; U.S. Air Force; U.S. Marine Corps; U.S. Space Force,"Nov 17, 2025"
Palladyne AI Establishes Defense Division Through $31M Strategic Acquisitions of GuideTech and Crucis Companies,80,Palladyne AI Corp (NASDAQ: PDYN) formed new Palladyne Defense division via acquisition of GuideTech Inc. (North Carolina-based defense avionics/engineering) and The Crucis Companies (Texas-based precision manufacturing) for combined $31M consideration. GuideTech brings flight-tested attritable autonomous systems and established contracts with major defense primes plus emerging tech companies. Crucis provides U.S.-based precision manufacturing and rapid prototyping capabilities. New division combines embodied AI rapid development and domestic production targeting low-cost autonomous systems for defense. Palladyne expects combined operations to more than triple 2024 revenue of $7.8M by 2026. Current backlog exceeds $10M over 18 months. GuideTech owners eligible for up to $25M contingent earn-out over 5 years once cumulative product revenue exceeds $71M. Palladyne Commercial continues separate development of Palladyne IQ and Pilot for aviation/manufacturing/logistics.,https://dronelife.com/2025/11/17/palladyne-ai-forms-new-defense-division-through-strategic-acquisitions/,VC Investors: HIGH - Demonstrates M&A rollup strategy in defense autonomy with clear revenue visibility. Founders: VERY HIGH - Blueprint for scaling defense AI through strategic acquisitions combining tech and manufacturing. Institutional: MEDIUM-HIGH - Revenue growth trajectory (3x by 2026) and backlog validation. Researchers: MEDIUM - Embodied AI and attritable systems development approach. General: LOW - Technical defense industry story.,Showcases alternative pathway to defense tech scale via M&A rather than organic growth acquiring both technology (GuideTech avionics) and manufacturing capacity (Crucis) simultaneously. Addresses critical gap in affordable attritable autonomous systems that don't compete with existing prime contractor portfolios. Strategic timing aligns with DoD's push for faster acquisition (Hegseth reforms) and lower-cost alternatives to exquisite systems. Revenue projection (3x growth to approximately $23M by 2026) demonstrates realistic scaling path for defense AI startups. Flight-tested systems and prime contractor relationships provide validation and distribution channels. U.S.-based manufacturing addresses supply chain sovereignty concerns.,Palladyne AI; GuideTech Inc.; The Crucis Companies,"Nov 17, 2025"
Northrop Grumman awarded $304M F-16 radar sustainment IDIQ for eight partner nations,78,"Northrop Grumman received a $303.6 million indefinite-delivery/indefinite-quantity contract from the U.S. Air Force for repair and return of F-16 radar components supporting foreign-military-sales customers in Bahrain, Bulgaria, Greece, South Korea, Slovakia, Taiwan, Morocco and Jordan through November 2030.",https://www.govconwire.com/articles/northrop-f16-radar-contract-304m-fms,Institutional investors and allied airpower strategists,"Shows sustained global investment in legacy F-16 fleets and AESA radar upgrades, extending the platform’s relevance and reinforcing Northrop’s radar franchise across a broad coalition of U.S. partners in Europe, the Middle East and Asia.",Northrop Grumman; U.S. Air Force; F-16 international operators,2025-11-17
General Atomics Showcases Collaborative Combat Aircraft Full-Scale Model at Dubai Airshow 2025,78,General Atomics Aeronautical Systems (GA-ASI) displays full-scale model of its Collaborative Combat Aircraft (CCA) design for U.S. Air Force at Dubai Airshow November 17-21 2025 (Stand #1280). Autonomous unmanned fighter jet developed under Air Force program to provide loyal wingman capability alongside manned aircraft like F-35 and F-22. Model demonstrates GA-ASI's entry into next-generation air combat market leveraging company's 30+ years and 9M+ flight hours of UAS experience with Predator/Reaper/Gray Eagle platforms. Following Dubai CCA model tours to DIMDEX (Doha Qatar Jan 19-22 2026) and World Defense Show (Riyadh Saudi Arabia Feb 8-12 2026) signaling international marketing push. Display occurs as Air Force refines CCA requirements with Increment 2 targeting lower unit costs (approximately $15M vs Increment 1's approximately $30M) for more attritable platforms. GA-ASI competes against Anduril Industries (also selected for CCA program) to supply hundreds of autonomous combat aircraft starting late 2020s.,https://www.ga-asi.com/ga-asi-showcases-collaborative-combat-aircraft-at-dubai-airshow,VC Investors: HIGH - Validates autonomous combat aircraft market with major prime contractor (GA-ASI) investment. Founders: HIGH - Shows competitive landscape for CCA program alongside Anduril providing market validation for defense tech entrants. Institutional: VERY HIGH - Multi-billion dollar program with GA-ASI heritage providing confidence in execution. Researchers: HIGH - Autonomous fighter teaming doctrine and technology maturation. General: MEDIUM - Future of air warfare relevance.,First major international showcase of GA-ASI's CCA design demonstrates company's strategic shift from traditional UAS to autonomous fighter platforms. Validates autonomous combat aircraft transitioning from concept to near-term procurement as Air Force plans hundreds of CCAs by early 2030s. Regional tour (UAE Qatar Saudi Arabia) signals export potential and allied interest in loyal wingman technology amid China's demonstrated GJ-11/J-20 teaming capability (reported Nov 10-15). Competition dynamic between legacy defense contractor (GA-ASI with decades of UAS experience) and newcomer (Anduril at $30B+ valuation) represents broader defense industrial base transformation. Air Force's cost reduction focus for Increment 2 ($15M target) emphasizes affordability and mass production over exquisite capabilities aligning with attritable warfare concepts. Middle East timing strategic given regional tensions and high defense spending by Gulf states.,General Atomics Aeronautical Systems (GA-ASI); U.S. Air Force; Anduril Industries (competitor),November 17-21 2025
Emirates Airlines Orders 65 Boeing 777-9 Aircraft Worth $38B at Dubai Airshow and Announces Starlink Fleet-Wide Rollout,76,Emirates placed $38B order (list price) for 65 additional Boeing 777-9 widebody aircraft at Dubai Airshow opening day November 17 increasing total 777X commitment to 270 aircraft (205 777-9s and 65 777-8s). Deal extends Emirates' delivery schedule through 2038 and represents major vote of confidence in long-delayed 777X program amid Boeing's recovery efforts. Simultaneously announced fleet-wide deployment of SpaceX Starlink high-speed Wi-Fi across 200+ aircraft starting November 2025 with Boeing 777 fleet (first commercial flight immediately post-Airshow on A6-EPF). Deliveries of 777-9 expected to begin 2026 after regulatory certification. Order valued by Trump Administration as major U.S. investment signal. Emirates President Tim Clark scheduled for CNBC interview Nov 18. Boeing opened Dubai Airshow with strong momentum after challenging 2024-2025 period marked by production issues and strike.,https://www.cnbc.com/2025/11/17/emirates-bets-big-on-boeing-with-38-billion-order-at-dubai-airshow.html,VC Investors: MEDIUM - Validates commercial aerospace recovery but limited startup implications. Founders: LOW - Traditional aerospace deal structure. Institutional: VERY HIGH - Critical for Boeing's financial recovery and 777X program validation plus SpaceX/Starlink revenue diversification. Researchers: MEDIUM - Aerospace industry cycle and technology adoption (Starlink integration). General: HIGH - Major aviation deal with consumer Wi-Fi implications.,Provides crucial external validation for Boeing's troubled 777X program which has faced years of delays and certification challenges as Emirates (largest 777 operator) carries significant credibility. $38B order (even at discounted contract prices) injects confidence in Boeing's widebody strategy and supports production ramp-up plans. Starlink adoption by world's largest international carrier represents major milestone for SpaceX's aviation connectivity business competing directly with traditional satellite providers (Viasat Intelsat). Deal timing advantageous for Trump Administration's emphasis on foreign investment in U.S. manufacturing. Emirates' 2038 delivery timeline provides Boeing long-term order book stability critical for industrial planning and investor confidence. Demonstrates Gulf region carriers' continued fleet expansion despite global economic uncertainties. SpaceX integration signals aviation industry shift toward LEO constellation connectivity vs. GEO satellites.,Emirates Airlines; Boeing; SpaceX/Starlink; flydubai; GE Aerospace,November 17 2025
Infinite Orbits raises €40M to scale in-orbit satellite servicing and debris-removal platform,75,"French spacetech startup Infinite Orbits closed a €40 million growth round led by the European Innovation Council Fund to expand satellite-life-extension and orbital-debris-removal services across key European and international operators, positioning itself as critical infrastructure for space sustainability.",https://sesamers.com/blog/infinite-orbits-40m-satellite-servicing-funding/,VCs & space founders focused on on-orbit services,"Backed by a strategic EU vehicle, the deal underscores satellite servicing and debris mitigation as priority capabilities for European space sovereignty and opens a capitalised competitor in the emerging in-orbit services race alongside U.S. and Japanese players.",Infinite Orbits; European Innovation Council Fund,2025-11-17
Rocket Lab Schedules Hypersonic Test Mission from Wallops Island as Part of HASTE Program,75,Rocket Lab prepares to launch modified Electron rocket as part of Hypersonic Accelerator Suborbital Test Electron (HASTE) program from Launch Complex 2 at NASA Wallops Flight Facility on November 18 2025 (delayed from earlier in month). Sub-orbital mission tests hypersonic technologies for Naval Surface Warfare Center Crane Division and Leidos Dynetics' Multi-Service Advanced Capability Hypersonic Test Bed (MACH-TB). HASTE program leverages Electron's flight-proven systems for rapid responsive hypersonic testing capability which is critical for accelerating development of time-sensitive defense technologies. Mission represents continued momentum for Rocket Lab despite Neutron delay to Q1 2026 with company targeting 17+ Electron launches in 2025 (surpassing 2024's record 16 missions). Wallops LC-2 facility operational since August 2025 serves dual purpose supporting both Electron HASTE missions and future Neutron launches from adjacent LC-3.,https://rocketlaunch.org/launch-schedule/rocket-lab,VC Investors: MEDIUM-HIGH - Demonstrates DoD adoption of commercial launch for rapid hypersonic testing. Founders: HIGH - Shows dual-use platform strategy where same rocket serves commercial and defense missions. Institutional: MEDIUM - Validates launch services diversification beyond satellite deployment. Researchers: HIGH - Hypersonic technology development acceleration through responsive launch. General: LOW - Technical military aerospace program.,Demonstrates Rocket Lab's strategic positioning in responsive launch for defense applications which is critical capability as hypersonic weapons development accelerates globally (China's DF-27 Russia's Avangard U.S. programs). HASTE program enables rapid flexible hypersonic testing vs. traditional sounding rockets or dedicated test ranges. Wallops location provides East Coast launch capability for DoD complementing West Coast operations from New Zealand. Modified Electron platform proves commercial space technology viability for time-critical defense R&D addressing DoD's need for faster acquisition cycles. Mission timing while Neutron delayed to 2026 maintains Rocket Lab's defense customer engagement and revenue diversity. Partnership with Leidos Dynetics (major defense contractor) validates small launch provider integration into traditional defense industrial base.,Rocket Lab; Naval Surface Warfare Center Crane Division; Leidos Dynetics; NASA,2025-11-18
U.S. Helsinki Commission Hosts Hearing on Deterrence at NATO Eastern Flank Amid Russian Airspace Incursions,72,U.S. Commission on Security and Cooperation in Europe (Helsinki Commission) held hearing on Deterrence at NATO's Eastern Flank on November 17 2025 at 3:30pm EST featuring Estonian Foreign Minister Margus Tsahkna CSIS President Seth Jones and Hudson Institute's Peter Rough. Hearing addresses Russia's recent airspace incursions into Estonia Lithuania Poland and Romania as part of systematic campaign to probe NATO defenses test Western response limits and gather intelligence on capabilities. Comes amid Pentagon's controversial decision to reduce U.S. troop presence in Romania alarming frontline allies who fear inviting further Russian aggression. Helsinki Commission Chairman Sen. Roger Wicker (R-MS) and Commissioner Sen. Jeanne Shaheen (D-NH) introduced Eastern Flank Strategic Partnership Act to deepen defense cooperation with Eastern European allies and direct support to highest-threat areas. Discussion examines Russia's simultaneous intensification of Ukraine war and shadow war against NATO through hybrid tactics.,https://www.csce.gov/hearings/deterrence-on-natos-eastern-flank/,VC Investors: MEDIUM - Geopolitical risk context for European defense market opportunities. Founders: MEDIUM - European defense procurement urgency creates startup market entry windows. Institutional: HIGH - Validates continued European defense spending trajectory and U.S. commitment questions. Researchers: VERY HIGH - NATO strategy hybrid warfare tactics and alliance cohesion analysis. General: HIGH - Geopolitical tensions and U.S. foreign policy debate relevance.,Highlights escalating Russian hybrid warfare tactics against NATO members through airspace violations cyberattacks and infrastructure sabotage validating European defense spending increases. Pentagon's Romania troop reduction decision amid rising threats creates policy tension between resource allocation (Indo-Pacific focus) and European ally reassurance. Eastern Flank Strategic Partnership Act represents bipartisan Congressional response to perceived gaps in Eastern European security architecture signaling potential increased U.S. military aid and cooperation. Estonian Lithuanian and Polish alarm reflects frontline states' assessment of Russian intentions and NATO preparedness. Hearing timing amid Ukraine war stalemate and uncertainty about U.S. NATO commitment (Trump Administration's transactional approach) adds urgency. Validates continued growth trajectory for European defense contractors U.S. arms exports to Eastern Europe and hardening of critical infrastructure against hybrid threats.,U.S. Helsinki Commission; Estonian Ministry of Foreign Affairs; Center for Strategic and International Studies (CSIS); Hudson Institute,2025-11-17